{
  "$schema": "./kickoff-manifest.schema.json",
  "schemaVersion": 1,
  "project": {
    "name": "indy-init-root-cause-investigator",
    "product": "Reusable Root-Cause Investigation Platform",
    "competitionProfile": "Indy Init 2026"
  },
  "planningBaseline": {
    "repository": "kemiller2002/Indy-init",
    "refPolicy": "pin-exact-commit-at-kickoff",
    "boundaryDocument": "docs/HACKATHON-BOUNDARIES.md"
  },
  "components": [
    { "id": "ordo", "purpose": "state-directed domain requirements and legal-transition discipline", "required": true },
    { "id": "ros", "purpose": "work execution, attribution, evidence, and completion governance", "required": true },
    { "id": "aegis", "purpose": "structured invariant, policy, integration, and runtime faults", "required": true },
    { "id": "praxis", "purpose": "engineering metrics, thresholds, churn, and proof evidence", "required": true },
    { "id": "limen", "purpose": "F#/WASM browser boundary and local deterministic execution", "required": true },
    { "id": "forma", "purpose": "accessible reusable web-component vocabulary", "required": true },
    { "id": "folio", "purpose": "professional investigation and engineering proof reports", "required": true },
    { "id": "percepta", "purpose": "machine-checkable application-specific UI meaning and evidence", "required": true }
  ],
  "normativeDocuments": [
    { "id": "product", "path": "docs/PRODUCT-REQUIREMENTS.md", "role": "canonical durable product requirements", "requiredBeforeCoding": true },
    { "id": "release", "path": "docs/REQUIREMENTS.md", "role": "competition release-profile requirements", "requiredBeforeCoding": true },
    { "id": "semantics", "path": "docs/INVESTIGATION-SEMANTICS.md", "role": "canonical epistemic and causal semantics", "requiredBeforeCoding": true },
    { "id": "evolution", "path": "docs/SEMANTIC-EVOLUTION.md", "role": "research-safe semantic evolution rules", "requiredBeforeCoding": true },
    { "id": "decisions", "path": "docs/DESIGN-DECISION-BOUNDARIES.md", "role": "locked, reversible, experimental, and deferred decision boundaries", "requiredBeforeCoding": true },
    { "id": "core", "path": "docs/CORE-DOMAIN-MODEL.md", "role": "minimal generic aggregate boundary", "requiredBeforeCoding": true },
    { "id": "commands", "path": "docs/COMMAND-EVENT-CATALOG.md", "role": "authoritative command and event vocabulary", "requiredBeforeCoding": true },
    { "id": "transitions", "path": "docs/STATE-TRANSITION-TABLES.md", "role": "structural lifecycle transition contract", "requiredBeforeCoding": true },
    { "id": "fsharp", "path": "docs/FSHARP-TYPE-SHAPES.md", "role": "first implementation typed-domain profile", "requiredBeforeCoding": true },
    { "id": "policy", "path": "docs/POLICY-ENGINE.md", "role": "blockers, capabilities, review, and policy composition", "requiredBeforeCoding": true },
    { "id": "persistence", "path": "docs/PERSISTENCE-CONTRACT.md", "role": "local-first, GitHub-provider, portability, and recovery contract", "requiredBeforeCoding": true },
    { "id": "ai", "path": "docs/AI-ORCHESTRATION.md", "role": "proposal-oriented AI orchestration", "requiredBeforeCoding": true },
    { "id": "workspace", "path": "docs/INVESTIGATION-WORKSPACE.md", "role": "primary user experience contract", "requiredBeforeCoding": true },
    { "id": "screens", "path": "docs/SCREEN-CONTRACTS.md", "role": "screen-by-screen semantic UI baseline", "requiredBeforeCoding": true },
    { "id": "tests", "path": "docs/DOMAIN-TEST-MATRIX.md", "role": "domain test obligations", "requiredBeforeCoding": true },
    { "id": "security", "path": "docs/SECURITY-THREAT-MODEL.md", "role": "trust boundaries and production security posture", "requiredBeforeCoding": true },
    { "id": "slices", "path": "docs/IMPLEMENTATION-SLICES.md", "role": "ordered build sequence", "requiredBeforeCoding": true },
    { "id": "competition", "path": "docs/COMPETITION-ALIGNMENT.md", "role": "published challenge alignment", "requiredBeforeCoding": false },
    { "id": "build-day", "path": "docs/BUILD-DAY-EXECUTION.md", "role": "competition-day operating plan", "requiredBeforeCoding": false }
  ],
  "prioritySlices": [
    { "order": 1, "id": "bootstrap", "goal": "capture blank-repo provenance and establish governed engineering environment", "cutPolicy": "never-cut" },
    { "order": 2, "id": "semantic-kernel", "goal": "typed generic investigation state, commands, events, decide/evolve", "cutPolicy": "never-cut" },
    { "order": 3, "id": "policy-capabilities", "goal": "deterministic blockers, legal actions, cause and resolution gates", "cutPolicy": "never-cut" },
    { "order": 4, "id": "workspace", "goal": "one complete accessible investigation workspace", "cutPolicy": "never-cut" },
    { "order": 5, "id": "local-persistence", "goal": "durable local work and honest pending/synced state", "cutPolicy": "never-cut" },
    { "order": 6, "id": "github-provider", "goal": "provider-independent remote persistence with optimistic concurrency", "cutPolicy": "cut-last" },
    { "order": 7, "id": "ai-proposals", "goal": "bounded context and proof-carrying structured AI proposals", "cutPolicy": "never-cut" },
    { "order": 8, "id": "investigation-loop", "goal": "prediction, action, finding, cause, correction, verification, resolution", "cutPolicy": "never-cut" },
    { "order": 9, "id": "time-travel", "goal": "semantic diff and what-changed-my-mind explanation", "cutPolicy": "cut-last" },
    { "order": 10, "id": "multi-agent", "goal": "blind Generator, Skeptic, and Evidence Auditor panel", "cutPolicy": "stretch" },
    { "order": 11, "id": "factory-proof", "goal": "real requirements/test/metrics/commit/proof view", "cutPolicy": "never-cut" },
    { "order": 12, "id": "counterfactual", "goal": "sandbox branch without source mutation", "cutPolicy": "stretch" }
  ],
  "screenContracts": [
    "S01 Investigation Start",
    "S02 Investigation Workspace",
    "S03 Hypothesis Battlefield",
    "S04 Hypothesis Detail",
    "S05 Evidence Capture",
    "S06 Evidence Detail",
    "S07 Evidence Dependency",
    "S08 Unknown / Assumption / Contradiction",
    "S09 Action / Experiment Designer",
    "S10 Finding / Result Capture",
    "S11 Cause Review",
    "S12 Corrective Action",
    "S13 Verification",
    "S14 History / Time Travel",
    "S15 Semantic Diff",
    "S16 Counterfactual Sandbox",
    "S17 Multi-Agent Panel",
    "S18 Research Tournament",
    "S19 Replay / Spectator",
    "S20 Factory View",
    "S21 Requirements Proof",
    "S22 Report Preview",
    "S23 Persistence / Conflict Recovery",
    "S24 Settings / Semantic Manifest",
    "S25 Demo Health"
  ],
  "stopTheLine": [
    "UI reimplements transition legality instead of consuming domain capabilities",
    "AI mutates raw authoritative state outside typed commands",
    "GitHub SHA/path becomes generic domain identity",
    "EDF research concepts enter generic core without explicit promotion",
    "pending local work is represented as remotely synced",
    "unknown extension data is silently dropped",
    "migration fabricates historical information",
    "implemented corrective action is represented as verified without verification evidence",
    "original observation/evidence source is overwritten by normalization",
    "critical blocker is hidden on mobile or inaccessible to assistive technology",
    "credential or secret appears in investigation state, AI context, report, or proof bundle"
  ],
  "successGates": [
    { "id": "domain", "evidence": "typed domain builds and protected transition tests pass" },
    { "id": "workspace", "evidence": "manual end-to-end investigation works on iPad and phone layouts" },
    { "id": "persistence", "evidence": "refresh/offline/reconnect preserves intent and never lies about sync state" },
    { "id": "ai", "evidence": "AI proposals are structured, attributable, challengeable, and cannot bypass policy" },
    { "id": "causality", "evidence": "causal set confirmation blocks until gate satisfied" },
    { "id": "verification", "evidence": "resolution is blocked until required correction verification succeeds" },
    { "id": "security", "evidence": "prompt-injection and tool/capability boundary smoke tests pass" },
    { "id": "factory", "evidence": "real requirement-to-work-to-test-to-commit/proof trace is visible" },
    { "id": "competition", "evidence": "demo health check and exact-build proof bundle pass before freeze" }
  ],
  "agentProtocol": {
    "entryDocument": "kickoff/indy-init.kickoff.json",
    "decisionRule": "Use the most reversible choice consistent with normative contracts; never resolve Experimental or Deferred research by silently hard-coding persisted semantics.",
    "completionRule": "A work item is complete only when its requirement, implementation, tests, runtime/verification evidence, and ROS/Praxis/Aegis obligations are satisfied or an explicit deviation is recorded."
  }
}